{
  "$schema": "./ecosystem.schema.json",
  "version": "2.2.0",
  "status": "canonical",
  "issue": "https://github.com/paglaai/pagladesign/issues/3",
  "updated": "2026-09-24",
  "authority": {
    "id": "pagladesign",
    "displayName": "PaglaDESIGN",
    "repo": "paglaai/pagladesign",
    "url": "https://github.com/paglaai/pagladesign",
    "role": "authority",
    "description": "Canonical design system, BrandKit, DesignDNA, and UX foundation for the entire PaglaAI ecosystem.",
    "provides": ["tokens", "brand", "typography", "components", "templates", "renderers", "mcp", "design-dna"],
    "deploy": null
  },
  "ecosystem": [
    {
      "id": "pagladesign",
      "displayName": "PaglaDESIGN",
      "repo": "paglaai/pagladesign",
      "url": "https://github.com/paglaai/pagladesign",
      "role": "authority",
      "category": "design-system",
      "status": "active",
      "audience": ["human", "machine", "architect"],
      "provides": ["tokens", "brand", "components", "renderers", "design-dna"],
      "consumes": []
    },
    {
      "id": "paglaai.space",
      "displayName": "PaglaAI.space",
      "repo": "paglaai/paglaai.space",
      "url": "https://github.com/paglaai/paglaai.space",
      "homepage": "https://paglaai.space",
      "role": "surface",
      "category": "website",
      "status": "active",
      "audience": ["human"],
      "provides": ["website"],
      "consumes": ["pagladesign/tokens", "pagladesign/brand", "pagladesign/design-dna"],
      "deploy": {
        "provider": "cloudflare-pages",
        "project": "paglaai",
        "productionBranch": "main",
        "workflow": ".github/workflows/deploy.yml"
      }
    },
    {
      "id": "apphole.store",
      "displayName": "apphole.store",
      "repo": "paglaai/apphole.store",
      "url": "https://github.com/paglaai/apphole.store",
      "homepage": "https://apphole.store",
      "role": "surface",
      "category": "storefront",
      "status": "planned",
      "audience": ["human", "machine"],
      "provides": ["package-catalog", "app-storefront", "release-feed"],
      "consumes": ["pagladesign/tokens", "pagladesign/design-dna", "ecosystem.json"],
      "deploy": {
        "provider": "cloudflare-pages",
        "project": "apphole-store",
        "note": "DNS only for now — catalog generator to reflect public repos, releases, packages"
      },
      "notes": "App/package storefront for the PaglaAI ecosystem. Reflects GitHub public repos, releases, and published packages. DesignDNA applies. Domain owned 2026-09."
    },
    {
      "id": "paglaai-docs",
      "displayName": "paglaai-docs",
      "repo": "paglaai/paglaai-docs",
      "url": "https://github.com/paglaai/paglaai-docs",
      "role": "surface",
      "category": "documentation",
      "status": "active",
      "audience": ["human", "machine", "architect"],
      "provides": ["docs"],
      "consumes": ["pagladesign/renderers", "pagladesign/design-dna"]
    },
    {
      "id": "sanctum",
      "displayName": "SANCTUM Runtime",
      "repo": "paglaai/sanctum",
      "url": "https://github.com/paglaai/sanctum",
      "role": "runtime",
      "category": "architecture",
      "status": "planned",
      "audience": ["architect"],
      "provides": ["runtime", "architecture"],
      "consumes": ["pagladesign/architect-renderer"]
    },
    {
      "id": "paglashell",
      "displayName": "PaglaSHELL",
      "repo": "paglaai/PaglaSHELL",
      "url": "https://github.com/paglaai/PaglaSHELL",
      "role": "product",
      "category": "cli",
      "status": "active",
      "audience": ["human", "machine"],
      "provides": ["cli", "execution-kernel"],
      "consumes": ["pagladesign/tokens", "pagladesign/components"]
    },
    {
      "id": "b3k4r",
      "displayName": "B3K4R",
      "repo": "paglaai/B3K4R",
      "url": "https://github.com/paglaai/B3K4R",
      "role": "product",
      "category": "application",
      "status": "active",
      "audience": ["human"],
      "provides": ["job-hunting", "career-intelligence"],
      "consumes": ["pagladesign/tokens", "pagladesign/components"]
    },
    {
      "id": "paglamlx",
      "displayName": "PaglaMLX",
      "repo": "paglaai/PaglaMLX",
      "url": "https://github.com/paglaai/PaglaMLX",
      "role": "product",
      "category": "inference",
      "status": "active",
      "audience": ["human", "machine"],
      "provides": ["local-inference", "mlx-orchestration"],
      "consumes": ["pagladesign/tokens"]
    },
    {
      "id": "paglarouter",
      "displayName": "PaglaROUTER",
      "repo": "paglaai/PaglaROUTER",
      "url": "https://github.com/paglaai/PaglaROUTER",
      "role": "product",
      "category": "gateway",
      "status": "active",
      "audience": ["human", "machine"],
      "provides": ["llm-gateway", "model-routing"],
      "consumes": ["pagladesign/tokens"]
    },
    {
      "id": "paglachat",
      "displayName": "PaglaCHAT",
      "repo": "paglaai/PaglaCHAT",
      "url": "https://github.com/paglaai/PaglaCHAT",
      "role": "product",
      "category": "chat",
      "status": "active",
      "audience": ["human"],
      "provides": ["conversational-interface"],
      "consumes": ["pagladesign/tokens", "pagladesign/components"]
    },
    {
      "id": "paglaos",
      "displayName": "PaglaOS",
      "repo": "paglaai/KolponaOS",
      "alias": "KolponaOS",
      "url": "https://github.com/paglaai/KolponaOS",
      "role": "product",
      "category": "operating-system",
      "status": "active",
      "audience": ["human", "architect"],
      "provides": ["os", "substrate"],
      "consumes": ["pagladesign/tokens", "sanctum/runtime"]
    },
    {
      "id": "paglaapi",
      "displayName": "PaglaAPI",
      "repo": "paglaai/paglaapi",
      "url": "https://github.com/paglaai/paglaapi",
      "role": "product",
      "category": "api",
      "status": "planned",
      "audience": ["machine"],
      "provides": ["api-endpoint"],
      "consumes": ["pagladesign/machine-renderer"]
    },
    {
      "id": "paglacpp",
      "displayName": "PaglaCPP",
      "repo": "paglaai/paglacpp",
      "url": "https://github.com/paglaai/paglacpp",
      "role": "product",
      "category": "systems",
      "status": "planned",
      "audience": ["machine", "architect"],
      "provides": ["systems-runtime"],
      "consumes": ["pagladesign/tokens"]
    },
    {
      "id": "paglamtp",
      "displayName": "PaglaMTP",
      "repo": "paglaai/paglamtp",
      "url": "https://github.com/paglaai/paglamtp",
      "role": "product",
      "category": "inference",
      "status": "planned",
      "audience": ["machine"],
      "provides": ["parallel-thought"],
      "consumes": ["pagladesign/machine-renderer"]
    },
    {
      "id": "paglaui",
      "displayName": "PaglaUI",
      "repo": "paglaai/paglaui",
      "url": "https://github.com/paglaai/paglaui",
      "role": "product",
      "category": "ui-kit",
      "status": "planned",
      "audience": ["human", "machine"],
      "provides": ["component-framework"],
      "consumes": ["pagladesign/tokens", "pagladesign/components"]
    },
    {
      "id": "paglabrand",
      "displayName": "PaglaBRAND",
      "repo": "paglaai/paglabrand",
      "url": "https://github.com/paglaai/paglabrand",
      "role": "product",
      "category": "brand",
      "status": "planned",
      "audience": ["human"],
      "provides": ["brand-assets"],
      "consumes": ["pagladesign/brand"]
    },
    {
      "id": "paglagpt",
      "displayName": "PaglaGPT",
      "repo": "paglaai/PaglaGPT",
      "url": "https://github.com/paglaai/PaglaGPT",
      "role": "product",
      "category": "model",
      "status": "active",
      "audience": ["human", "machine"],
      "provides": ["model-interface"],
      "consumes": ["pagladesign/tokens", "pagladesign/design-dna"]
    }
  ],
  "documentation": {
    "sources": [
      {
        "id": "pagladesign",
        "repo": "paglaai/PaglaDESIGN",
        "path": "/",
        "role": "authority"
      },
      {
        "id": "paglaai.space",
        "repo": "paglaai/paglaai.space",
        "path": "docs/",
        "role": "surface"
      },
      {
        "id": "paglaai-docs",
        "repo": "paglaai/paglaai-docs",
        "path": "/",
        "role": "unified-docs"
      }
    ],
    "designDna": "design-system/DESIGN_DNA.md",
    "rendererContract": "design-system/RENDERER_API.md",
    "renderers": {
      "fern": {
        "audience": "human",
        "output": "html",
        "spec": "design-system/FERN_RENDERER.md",
        "consumer": "paglaai.space"
      },
      "machine": {
        "audience": "machine",
        "output": ["json", "openapi", "mcp-bundle", "prompt-bundle"],
        "spec": "design-system/MACHINE_RENDERER.md"
      },
      "architect": {
        "audience": "architect",
        "output": ["rfc", "adr", "governance", "audit-ui"],
        "spec": "design-system/ARCHITECT_RENDERER.md"
      }
    }
  },
  "pipelines": {
    "githubToCloudflare": {
      "description": "PaglaDESIGN → consumer rebuild chain",
      "trigger": {
        "repo": "paglaai/PaglaDESIGN",
        "event": "push to main",
        "paths": ["design-system/**", "css/**", "ecosystem.json", "brand/**"]
      },
      "steps": [
        {
          "name": "validate-tokens",
          "action": ".github/actions/build-tokens"
        },
        {
          "name": "dispatch-downstream",
          "event": "design.updated",
          "targets": ["paglaai/paglaai.space", "paglaai/paglaai-docs"],
          "workflow": ".github/workflows/dispatch-downstream.yml"
        }
      ]
    },
    "ecosystemReflection": {
      "description": "Public repos, releases, packages → website + apphole.store",
      "sources": ["github org public repos", "github releases", "npm/pypi packages when published"],
      "targets": ["paglaai.space product grid", "apphole.store catalog"],
      "rule": "Never hand-edit product lists that the generator owns"